{
  "schemaVersion": "chatgpt.browser_control.operation_request.v1",
  "operationId": "11111111-1111-4111-8111-111111111111",
  "surface": "chat",
  "prompt": "Summarize the attached report.",
  "target": {
    "type": "conversation_id",
    "conversationId": "conversation-1"
  },
  "configuration": {
    "experience": "chat",
    "model": "model-family",
    "modelVersion": "model-version",
    "reasoning": "medium",
    "mode": "default",
    "tools": ["web"],
    "additional": {
      "temperatureHint": 0.2
    }
  },
  "files": [
    {
      "path": "/tmp/example.txt",
      "displayName": "example.txt"
    }
  ],
  "capture": {
    "responseContent": "metadata",
    "responseFormat": "markdown",
    "artifacts": "receipt_only"
  },
  "timeoutMs": 30000
}
